Course_Name,Level,Rating,Skills,Number of students,Platform
URosarioX: Diseño de Sistemas de información gerencial para Internet con MySQL / PHP y Joomla,1,4.671710515,"Content Management, Relational Databases, Information Systems, Management Information Systems, MySQL, Microsoft Access, PHP (Scripting Language), Joomla (Content Management System), Customer Relationship Management, Management, Mobile Phones",148077,EdX
IBM: Introduction to SQL,0,4.5,"Communications, Data Engineering, MySQL, SQL (Programming Language), Data Analysis, IBM DB2, Nested Queries, PostgreSQL, Data Manipulation, Relational Database Management Systems, Relational Databases, Microsoft Access, Data Science, Operations, Oracle SQL Developer, Database Systems",34979,EdX
HarvardX: CS50's Introduction to Databases with SQL,0,4.671710515,"Foreign Keys, Relational Databases, Java (Programming Language), MySQL, SQL (Programming Language), PostgreSQL, Data Store, Python (Programming Language), SQLite, Scalability",28977,EdX
IBM: Guided Project: Get Started with MySQL database,0,4.671710515,"Software Engineering, MySQL, Server-Side, Database Management Systems, Full Stack Development, Command-Line Interface",158594,EdX
MichiganX: Introduction to Data Analytics for Managers,0,4.671710515,"Machine Learning, Big Data, SQL (Programming Language), Business Case, Data Analysis, Data Science, Development Environment, Microsoft Azure, Analytical Techniques",158413,EdX
RITx: Data Analytics and Visualization in Health Care,2,4.8,"Health Informatics, Health Information Technology, Process Improvement, Population Health, Health Care Industry, Informatics, Data Analysis, Data Quality, Medical Records",13373,EdX
PennX: Big Data and Education,2,4.671710515,"Big Data, Research, Data Mining Methods, RapidMiner, Learning Analytics, Educational Effectiveness, Python (Programming Language), Educational Data Mining, Trustworthiness, Basic Research, Data Mining, Artificial Intelligence",18791,EdX
"UMD, USMx: Introduction to Transforming with Data Analytics and the Digital Organization",0,4.671710515,"Customer Service, Strategic Decision-Making, Data Visualization, Predictive Analytics, Artificial Intelligence, Digital Transformation, Machine Learning, Deep Learning, Business Process, Data Analysis, Business Modeling, Big Data, Customer Experience, Data Mining",157232,EdX
BabsonX: Analytics for Decision Making,0,4.1,"Data Science, Decision Making, Customer Engagement, Quantitative Modeling, Quantitative Models Of The Action Potential, Data Analysis, Statistical Methods, Statistics, Management, Statistical Thinking",39086,EdX
HKUSTx: Foundations of Data Analytics,1,4.671710515,"Data Processing, Data Integration, Machine Learning, Data Cleansing, Data Analysis, Python (Programming Language), Big Data, Data Security, Programming Tools, Data Extraction",151299,EdX
"IBM: Big Data, Hadoop, and Spark Basics",0,4.671710515,"Nodes (Networking), Spark Streaming, Satellite Imagery, Data Warehousing, File Systems, Apache Hive, Parallel Processing, Big Data, Apache Spark, Pyspark, Apache Hadoop, Unstructured Data, SQL (Programming Language), Analytical Skills, Resilience",8812,EdX
"UMD, USMx: Digital Marketing Analytics: Tools and Techniques",0,4.6,"Data-Driven Decision-Making, Marketing, Contextual Advertising, Artificial Intelligence, Digital Marketing, Machine Learning, Data Analysis, Surveys, Customer Data Management, Search Engine Optimization, Big Data, Analytics, Universal Testing Machines, Analytical Skills, Web Analytics",31121,EdX
IBM: Data Analytics Basics for Everyone,0,4.4,"Extract Transform Load (ETL), Big Data, Data Lakes, Data Structures, Relational Databases, Data Analysis, Data Warehousing",145660,EdX
IBM: The Data Science Method,0,4.3,"Problem Solving, Data Science, Big Data",16392,EdX
HKPolyUx: Knowledge Management and Big Data in Business,0,4.3,"Knowledge Management, Data Analysis, Social Sciences, Business Modeling, Management, Reasoning Systems, Service Design, Social Issue, Big Data, Cloud Computing, Physical Science, Artificial Intelligence",73806,EdX
KULeuvenX: Data Analytics in Health – From Basics to Business,1,4.671710515,"Business Planning, Big Data, Data Science, Data Analysis, Data Mining",153252,EdX
TecdeMonterreyX: Digital Marketing and Data Driven Analytics,1,4.671710515,"Algorithms, Influencer Marketing, Analytics, Big Data, Search Engine Marketing, Marketing, User Experience, Digital Communications, Search Engine Optimization, Digital Marketing, Social Media",9682,EdX
ACCA: Machine learning with Python for finance professionals,1,3.9,"Business Strategies, Association Of Chartered Certified Accountants, Jupyter, Finance, Python (Programming Language), Machine Learning, Customer Service, Financial Technology (FinTech)",16577,EdX
TokyoTechX: Introduction to Computer Science and Programming,0,4.671710515,"Computer Simulation, Cryptanalysis, Writing, Encryption, Data Mining, Big Data, Data Science, Artificial Intelligence, Computer Science, Algorithms, English Language, Forecasting, DNA Sequencing, Ruby (Programming Language)",8332,EdX
HECMontrealX: UX Data Analysis,1,4.671710515,"User Experience, User Experience Design (UX), Big Data, Usability Testing, Data Science, User Research, Statistical Methods, Microsoft Excel, Qualitative Data Analysis, Research, Web Analytics, Qualitative Research, Data Analysis",6471,EdX
IBM: Introduction to Data Science,0,4.5,"Big Data, Forecasting, Data Science, Tax Collections",147977,EdX
TsinghuaX: Data Mining: Theories and Algorithms for Tackling Big Data | 数据挖掘：理论与算法,2,4.671710515,"Data Science, Big Data, Data Mining, Big Data Analytics, Algorithms",146779,EdX
HKPolyUx: Innovation and Technology Management in Tourism and Hospitality,1,4.671710515,"Infrastructure, Tourism, Communications, Innovation, Business Modeling, Technical Management, Marketing, Hospitality",18323,EdX
HKUx: FinTech Technologies,0,4.4,"Finance, Big Data, Digital Currency, Financial Technology (FinTech), Banking, Distributed Ledgers, Machine Learning, Big Data Analytics, Artificial Intelligence, Cyber Security, Blockchain, Natural Language Processing",141302,EdX
WBGx: e-Learning on Digital Agriculture,0,4.7,"Technology Ecosystems, Resilience, Solar Application, Communications, Operations, Agriculture",13490,EdX
UCSanDiegoX: Big Data Analytics Using Spark,2,4.4,"Apache Hadoop, Apache Spark, Data Science, Big Data, Pyspark, Big Data Analytics, Hadoop Distributed File System (HDFS), Jupyter, MapReduce, Machine Learning, Distributed File Systems",58936,EdX
AdelaideX: Big Data Analytics,1,4.671710515,"Big Data, Creativity, Statistical Modeling, Analytic Applications, Big Data Analytics, Data Analysis, Data Science, Apache Spark",50290,EdX
UCSanDiegoX: Python for Data Science,2,3.4,"Python Tools For Visual Studio, Data Science, Git (Version Control System), Pandas (Python Package), Business Science, Python (Programming Language), Matplotlib",323638,EdX
HarvardX: Using Python for Research,1,3.9,"Python (Programming Language), Go (Programming Language), Research",334730,EdX
IBM: Analyzing Data with Python,0,4.5,"Scikit-learn (Machine Learning Library), Python (Programming Language), Pandas (Python Package), SciPy, NumPy, Machine Learning, Data Visualization, Data Analysis, Basic Math",150367,EdX
TsinghuaX: Advanced Big Data Systems | 高级大数据系统,0,4.671710515,"Big Data, Design Elements And Principles, Artificial Intelligence, Apache Spark",156891,EdX
IBM: Guided Project: Get Started with MongoDB CRUD Operations,0,4.671710515,"MongoDB, Operations, Relational Databases, Web Browsers, NoSQL, Data Structures",154176,EdX
IBM: Data Engineering Capstone Project,0,4.671710515,"Apache Airflow, Python (Programming Language), Data Collection, Bash (Scripting Language), Data Warehousing, NoSQL, Business Intelligence, Machine Learning, Relational Databases, MySQL, Relational Database Management Systems, IBM DB2, Big Data, PostgreSQL, Data Engineering, SQL (Programming Language), Predictive Analytics, Apache Spark, MongoDB, Extract Transform Load (ETL)",161059,EdX
IBM: Guided Project: Get Started with Cloudant NoSQL Database,1,4.671710515,Create an account),144779,EdX
AWS: Amazon DynamoDB: Building NoSQL Database-Driven Applications,1,5,"Lecturing, NoSQL, Amazon Web Services, Backup And Restore, Scalability, Document-Oriented Databases, Encryption, Demonstration Skills, Amazon DynamoDB",144040,EdX
"MichiganX: Database Architecture, Scale, and NoSQL with Elasticsearch",1,4.671710515,"Scalability, PostgreSQL, NoSQL, Relational Databases, Operations, Atomicity Consistency Isolation Durability (ACID), Elasticsearch, Database Architecture, SQL (Programming Language)",151435,EdX
"UMBC, USMx: NoSQL Databases",1,4.671710515,"JSON, Database Development, Relational Databases, NoSQL",153758,EdX
"IBM: Introduction to Cloud Native, DevOps, Agile, and NoSQL",1,4.2,"JSON, Application Development, MongoDB, Scrum (Software Development), Cloudant, Cloud Services, Continuous Delivery, Software Development Life Cycle, Artificial Intelligence, Application Programming Interface (API), Cloud-Native Applications, NoSQL, IBM Cloud Computing, DevOps, Behavior-Driven Development, Agile Methodology, User Story, Node.js, Continuous Integration, Public Cloud, Cloud-Native Computing, Software Quality (SQA/SQC), Web Ide, RESTful API, Git (Version Control System), Cloud Development",9807,EdX
IBM: NoSQL Database Basics,0,4.671710515,"Big Data, Agile Methodology, Apache Cassandra, NoSQL, Scalability, Database Management, Database as a Service (DBaaS), Database Permissions, Data as a Service (DaaS), MongoDB, Management, Relational Databases, Cloudant",147090,EdX
IBM: AI for Everyone: Master the Basics,0,4.3,"Deep Learning, Artificial Intelligence, Computer Science, Machine Learning, Artificial Neural Networks",149691,EdX
SmithsonianX: Teaching Critical Thinking through Art with the National Gallery of Art,0,5,"Project Zero, Critical Thinking, Zoom (Video Conferencing Tool), Pedagogy, Teaching, Arts Integration, Museum Education",31888,EdX
SNUx: Introduction to Optimization,0,4.671710515,"Natural Language Processing, Game Theory, Convex Optimization, Network Model, Forecasting, Simplex Algorithm, Nonlinear Programming, Network Routing, Algorithms, Linear Programming, Network Flow",155011,EdX
UMontrealX: Machine Learning Use Cases in Finance,0,4.671710515,"Information Extraction, Bitcoin, Mathematical Finance, Finance, Python (Programming Language), Reinforcement Learning, Machine Learning, Deep Learning, Artificial Intelligence, Basic Math, Computer Vision, Natural Language Processing, Financial Services, Financial Market, Research, Data Science",141713,EdX
UMontrealX: Deep Learning Essentials,1,4.671710515,"Signal Processing, Decision Making, Finance, Deep Learning, Machine Learning, Artificial Intelligence, Algorithms, Artificial Neural Networks, Computer Vision, Natural Language Processing, Data Science",7319,EdX
State-Bank-of-India: Engagement Banking,0,4.671710515,"Banking, Business Operations, Finance",151220,EdX
LinuxFoundationX: Data and AI Fundamentals,0,4.671710515,"Voice Assistant Technology, Linux, Finance, Smartphone Operation, Data Science, Natural Language Processing, Supply Chain, Forecasting, Artificial Intelligence, Innovation, Machine Learning, Data-Driven Decision-Making",144187,EdX
ColumbiaX: Artificial Intelligence (AI),2,4.671710515,"Industrial Robotics, Intelligent Agent, Machine Learning, Artificial Intelligence",160040,EdX
MITx: Machine Learning for Healthcare,2,4.671710515,"Machine Learning, Natural Language Processing, Image Processing, Artificial Cardiac Pacemakers, Workflow Management, Reference Ranges For Blood Tests, Algorithms, Deep Learning, Causal Inference, Python (Programming Language), Integration",142604,EdX
"FedericaX: Il linguaggio naturale, dall'uomo alla macchina",0,4.671710515,"Speech Recognition, Machine Learning, Linguistics, Phonetics, Speech Synthesis, Finale (Software), Management, VoiceXML, Hidden Markov Model, Piano",142920,EdX
HKUx: FinTech Technologies,0,4.4,"Finance, Big Data, Digital Currency, Financial Technology (FinTech), Banking, Distributed Ledgers, Machine Learning, Big Data Analytics, Artificial Intelligence, Cyber Security, Blockchain, Natural Language Processing",141803,EdX
Databricks: Large Language Models: Application through Production,1,4.6,"Workflow Management, Natural Language Processing",15403,EdX
PurdueX: Computer Applications of Artificial Intelligence and e-Construction,2,4.671710515,"Computational Tools, Machine Learning, Artificial Intelligence, Natural Language Processing, Applications Of Artificial Intelligence",151025,EdX
UCx: Text Analytics 2: Visualizing Natural Language Processing,0,4.671710515,"Computational Linguistics, Natural Language Processing, Deep Learning, Machine Learning, Topic Modeling, Jupyter, Text Mining, Pandas (Python Package), Artificial Intelligence, Choropleth Map, Python (Programming Language), Word Embedding, Matplotlib",154599,EdX
MichiganX: JSON and Natural Language Processing in PostgreSQL,1,4.671710515,"PostgreSQL, Natural Language Processing, JSON, Application Programming Interface (API)",142157,EdX
HarvardX: CS50's Introduction to Artificial Intelligence with Python,0,4.671710515,"Machine Translation, Search Algorithms, Computer Science, Python (Programming Language), Reinforcement Learning, Handwriting Recognition, Machine Learning, Intelligent Systems, Artificial Intelligence, Mathematical Optimization, Proofreading, Algorithms, Medical Diagnosis",871482,EdX
UCx: Text Analytics 1: Introduction to Natural Language Processing,0,4.671710515,"Scikit-learn (Machine Learning Library), Sentiment Analysis, Natural Language Processing, Go (Programming Language), Machine Learning, Text Processing, Data Science, Text Classification, Pandas (Python Package), Workflow Automation, Text Mining, Artificial Intelligence, Cognitive Science, Computational Linguistics, Python (Programming Language)",10482,EdX
Databricks: Large Language Models: Foundation Models from the Ground Up,2,4.671710515,"Decision Making, Transfer Learning, Natural Language Processing",7189,EdX
SNHUx: Structured Database Environments with SQL,0,4.671710515,"Data Store, Relational Database Management Systems, Scalability, Troubleshooting (Problem Solving), Database Management, Scalability Design, Python (Programming Language), SQL (Programming Language), Database Design, Business Intelligence, Data Management, Data Engineering, Foreign Keys, Data Analysis, MySQL, Dataset, Relational Model, Data Manipulation",159462,EdX
IBM: Data Engineering Capstone Project,0,4.671710515,"Apache Airflow, Python (Programming Language), Data Collection, Bash (Scripting Language), Data Warehousing, NoSQL, Business Intelligence, Machine Learning, Relational Databases, MySQL, Relational Database Management Systems, IBM DB2, Big Data, PostgreSQL, Data Engineering, SQL (Programming Language), Predictive Analytics, Apache Spark, MongoDB, Extract Transform Load (ETL)",151755,EdX
ColumbiaX: Analytics in Python,1,4.671710515,"Big Data, Data Acquisition, Python (Programming Language), Data Management",144568,EdX
IBM: Relational Database Administration (DBA),0,4.671710515,"Troubleshooting (Problem Solving), Database Administration, MySQL, SQL (Programming Language), Backup Devices, Automation, Database Security, PostgreSQL, Relational Databases",156479,EdX
IBM: Relational Database Basics,0,4.4,"MySQL, SQL (Programming Language), IBM DB2, Relational Database Design, Relational Database Management Systems, PostgreSQL, Relational Databases",6680,EdX
URosarioX: Diseño de Sistemas de información gerencial para Internet con MySQL / PHP y Joomla,1,4.671710515,"Content Management, Relational Databases, Information Systems, Management Information Systems, MySQL, Microsoft Access, PHP (Scripting Language), Joomla (Content Management System), Customer Relationship Management, Management, Mobile Phones",152101,EdX
IBM: Introduction to SQL,0,4.5,"Communications, Data Engineering, MySQL, SQL (Programming Language), Data Analysis, IBM DB2, Nested Queries, PostgreSQL, Data Manipulation, Relational Database Management Systems, Relational Databases, Microsoft Access, Data Science, Operations, Oracle SQL Developer, Database Systems",34979,EdX
HarvardX: CS50's Introduction to Databases with SQL,0,4.671710515,"Foreign Keys, Relational Databases, Java (Programming Language), MySQL, SQL (Programming Language), PostgreSQL, Data Store, Python (Programming Language), SQLite, Scalability",28977,EdX
IBM: Guided Project: Get Started with MySQL database,0,4.671710515,"Software Engineering, MySQL, Server-Side, Database Management Systems, Full Stack Development, Command-Line Interface",143844,EdX
"JuranX: Lean Six Sigma Black Belt Certification Part 1: Basic Improvement, Define and Measure",1,4.2,"Lean Six Sigma Black Belt, Lean Six Sigma",159855,EdX
TUMx: Six Sigma Part 1: Define and Measure,0,4.5,"Lean Six Sigma Green Belt, Define Measure Analyze Improve And Control (DMAIC), Six Sigma Yellow Belt, Six Sigma Green Belt Certification, Quality Management, Lean Manufacturing, Six Sigma Methodology, Quality Improvement, Lean Six Sigma, Process Improvement",128697,EdX
"TUMx: Six Sigma Part 2: Analyze, Improve, Control",0,4.8,"Lean Six Sigma Green Belt, Control Chart, Six Sigma Yellow Belt, Quality Improvement, Six Sigma Green Belt Certification, Design For Six Sigma, Confidence Intervals, Quality Management, Lean Manufacturing, Six Sigma Methodology, Statistics, Eight Disciplines Problem Solving (8D), Lean Six Sigma, Statistical Process Controls",84613,EdX
HarvardX: Introduction to Linear Models and Matrix Algebra,1,4.671710515,"Algebra, Functional Genomics, Life Sciences, R (Programming Language), Experimental Design, Statistical Inference, Matrix Algebra, Linear Model, Data Analysis, Statistics, Software Engineering, Bioconductor (Bioinformatics Software), Biology, Data Warehousing",115498,EdX
PurdueX: Pretensioned Structures,2,4.671710515,"Calculus, Numerical Analysis, Civil Engineering, Differential Equations, Building Codes, Data Manipulation, Statistical Analysis, Reinforced Concrete, Structural Systems, Structural Engineering",157429,EdX
"IITBombayX: Signals and Systems, Part 2",1,4.671710515,"Electrical Engineering, Signal Processing, Statistical Signal Processing, Control Systems, Laplace Transform, Electroencephalography, Computer Control Systems, Speech Recognition Software, Fourier Transform, Electric Power Systems, Telecommunications, Digital Signal Processing",155779,EdX
IBM: Guided Project: Get Started with Data Science in Agriculture,1,4.671710515,"Data Visualization, Data-Driven Decision-Making, Soil Science, Agriculture, Data Science, Data Analysis, Web Browsers, Pandas (Python Package), Seaborn, Statistical Analysis, Python (Programming Language), Python Tools For Visual Studio, Trend Line",155039,EdX
GeorgetownX: Impact Evaluation Methods with Applications in Low- and Middle-Income Countries,0,4.8,"Agriculture, Quick Learning, Innovation, Human Development, Health Education, Microfinance",143280,EdX
"IITBombayX: Signals and Systems, Part 1",1,4.671710515,"Electrical Engineering, Editing, Signal Processing, Statistical Signal Processing, Control Systems, Laplace Transform, Electroencephalography, Computer Control Systems, Speech Recognition Software, Fourier Transform, Electric Power Systems, Telecommunications, Digital Signal Processing",142651,EdX
MichiganX: Introduction to Data Analytics for Managers,0,4.671710515,"Machine Learning, Big Data, SQL (Programming Language), Business Case, Data Analysis, Data Science, Development Environment, Microsoft Azure, Analytical Techniques",148898,EdX
IIMBx: Applied Bayesian for Analytics,0,4.671710515,"Statistical Modeling, Statistics, Openbugs, Monte Carlo Methods, Bayesian Modeling",151399,EdX
WBGx: Evaluating Impact in Low- and Middle-Income Countries,0,4.7,"Agriculture, Quick Learning, Innovation, Health Education, Microfinance, Randomized Controlled Trial, Human Development",158414,EdX
HarvardX: Case Studies in Functional Genomics,2,4.671710515,"Functional Genomics, Ribonucleic Acid Sequencing, Quality Control, Life Sciences, R (Programming Language), DNA Methylation, Open-Source Software, Exploratory Data Analysis, Matrix Algebra, Statistical Inference, Linear Model, Data Analysis, Statistics, Software Engineering, Bioconductor (Bioinformatics Software), Experimentation, Biology, Data Warehousing",42122,EdX
HarvardX: Statistics and R,1,4,"Functional Genomics, Confidence Intervals, Life Sciences, R (Programming Language), Descriptive Statistics, Statistical Inference, Matrix Algebra, Linear Model, Statistical Analysis, Data Analysis, Statistics, Software Engineering, Bioconductor (Bioinformatics Software), Biology, Data Warehousing",448417,EdX
HarvardX: Statistical Inference and Modeling for High-throughput Experiments,1,4.671710515,"Functional Genomics, Next-Generation Sequencing, Maximum Likelihood, Linear Model, Matrix Algebra, Software Engineering, Bioconductor (Bioinformatics Software), Exploratory Data Analysis, Data Warehousing, DNA Sequencing, Life Sciences, R (Programming Language), Bayesian Statistics, Statistics, Research, Statistical Modeling, Statistical Inference, Data Analysis, Biology",63621,EdX
StanfordOnline: R Programming Fundamentals,0,4.6,"Computational Statistics, R (Programming Language)",35104,EdX
TecdeMonterreyX: Introduction to Data Science and Basic Statistics for Business,2,4.671710515,"Data Science, Big Data, Business Technologies, Statistical Methods, Statistics, Probability Distribution, Decision Making",153786,EdX
LSE: Statistics 1 Part 2: Statistical Methods,1,4.671710515,"Contingency Tables, Linear Regression, Basic Math, Statistics, Economics, Management, Sampling Design, Statistical Hypothesis Testing, Chi-Squared Tests, Statistical Methods, Social Sciences",151737,EdX
StellenboschX: People analytics and reporting,1,4.6,"Intangible Assets, Performance Management, Decision Making, Human Capital, Systems Of Measurement, People Management, Data Collection, Dashboard",158374,EdX
"LSE: Statistics 1 Part 1: Introductory statistics, probability and estimation",1,4.3,"Probability, Basic Math, Statistics, Economics, Social Sciences, Sampling (Statistics), Management, Probability Theories, Data Visualization, Statistical Methods, Normal Distribution",7216,EdX
UTokyoX: Basic Analytical Chemistry,0,4.671710515,"Analytical Techniques, Analytical Chemistry, Environmental Science, Life Sciences, Geochemistry, Chemistry",33263,EdX
AdelaideX: Big Data Analytics,1,4.671710515,"Big Data, Creativity, Statistical Modeling, Analytic Applications, Big Data Analytics, Data Analysis, Data Science, Apache Spark",50290,EdX
UTMBx: Biostatistics for Big Data Applications,0,4.671710515,"Population Health, Statistical Software, Big Data, Data Analysis, Statistical Theory, Biostatistics",143521,EdX
MITx: The Analytics Edge,1,4.671710515,"Logistic Regression, Statistical Software, Linear Regression, Text Mining",159809,EdX
DelftX: Statistics,1,4.671710515,"Basic Math, Machine Learning, Statistical Inference, Descriptive Statistics, Statistical Software, R (Programming Language), Data Science",147730,EdX
SNHUx: Scripting with Python,0,4.671710515,"File Handling, Scripting, Programming Concepts, Regular Expressions, Applied Statistics, Full Stack Development, Artificial Intelligence, User Interface, Machine Learning, Data Science, Syntax, SQL (Programming Language), Data Mining, Automation, Integrated Development Environments, Web Pages, Flowcharts, Python (Programming Language), Data Management, Business Analytics",144230,EdX
"UMD, USMx: Effecting Digital Transformation with  Data Analytics Projects",0,4.671710515,"Customer Service, Disciplined Agile Delivery, Organizational Change, Customer Experience, Digital Transformation, Organizational Leadership, Data Analysis, Lean Startup Methodology, Graph Database, Python (Programming Language), Agile Methodology, Solution Delivery, Data Transformation, R (Programming Language), Digital Media Strategy",157728,EdX
"UMD, USMx: Generating Vision: Long-Term Big Ideas That Motivate Employees and Stakeholders",0,4.671710515,"Ideation, Visionary, Brainstorming, Artificial Intelligence, Business Strategies, Management, Planning, Product Roadmaps, Scenario Planning",155957,EdX
"StellenboschX: Diversity, Equity and Inclusion (DEI) in the Workplace",1,4.6,"Emotional Intelligence, Diversity Management, Creativity, Innovation",156586,EdX
LinuxFoundationX: Ethics in AI and Data Science,0,4,"Accountability, Data Science, Data Analysis, Leadership, Ethical Principles, Artificial Intelligence, Emerging Technologies, Biology",10644,EdX
LinuxFoundationX: Data and AI Fundamentals,0,4.671710515,"Voice Assistant Technology, Linux, Finance, Smartphone Operation, Data Science, Natural Language Processing, Supply Chain, Forecasting, Artificial Intelligence, Innovation, Machine Learning, Data-Driven Decision-Making",141959,EdX
ACCA: Machine learning with Python for finance professionals,1,3.9,"Business Strategies, Association Of Chartered Certified Accountants, Jupyter, Finance, Python (Programming Language), Machine Learning, Customer Service, Financial Technology (FinTech)",16577,EdX
HKPolyUx: Knowledge Management and Big Data in Business,0,4.3,"Knowledge Management, Data Analysis, Social Sciences, Business Modeling, Management, Reasoning Systems, Service Design, Social Issue, Big Data, Cloud Computing, Physical Science, Artificial Intelligence",73806,EdX
