Course_Name,Level,Rating,Skills,Number of students,Platform
IBM: Guided Project: Build a COVID Dashboard with React,1,4.671710515,"React.js, JavaScript Libraries, Application Programming Interface (API), Cascading Style Sheets (CSS), Web Applications, JavaScript Frameworks, Single Page Application, HyperText Markup Language (HTML), Front End (Software Engineering), Chart.js, JavaScript (Programming Language)",145140,EdX
AWS: How to Buy Cloud - Strategies for Cloud Procurement,0,4.671710515,"Procurement, Amazon Web Services, Cloud Strategy",155754,EdX
HarvardX: CS50's Web Programming with Python and JavaScript,1,4.671710515,"Application Deployment, React.js, Application Programming Interface (API), Cloud Computing, Web Development, Cloud Services, Django (Web Framework), SQL (Programming Language), JavaScript (Programming Language), Github, Database Design, Computer Science, Python (Programming Language), Scalability",1379832,EdX
W3Cx: JavaScript Introduction,0,3.8,"Cascading Style Sheets (CSS), JavaScript (Programming Language), Front End (Software Engineering), Web Browsers, Web Development, Web Pages, Multimedia",214097,EdX
W3Cx: HTML5 and CSS Fundamentals,0,4.6,"Web Standards, Cascading Style Sheets (CSS), HTML5, Front End (Software Engineering), Web Development, Look And Feel, Web Design",403153,EdX
HarvardX: CS50's Mobile App Development with React Native,1,4.671710515,"React.js, Mobile Application Development, ECMAScript 2016, Java (Programming Language), JavaScript (Programming Language), ECMAScript 2015, React Native, Computer Science",144129,EdX
IBM: Full Stack Application Development Project,1,4.671710515,"Front End (Software Engineering), Node.js, Application Development, Full Stack Development, Django (Web Framework), Python (Programming Language), User Interface Design",22439,EdX
IBM: Guided Project: Web Development w/ HTML & CSS for Beginners,0,4.671710515,"Cascading Style Sheets (CSS), Software Engineering, Java (Programming Language), HyperText Markup Language (HTML), Look And Feel",148195,EdX
HarvardX: CS50's Web Programming with Python and JavaScript,1,4.671710515,"Application Deployment, React.js, Application Programming Interface (API), Cloud Computing, Web Development, Cloud Services, Django (Web Framework), SQL (Programming Language), JavaScript (Programming Language), Github, Database Design, Computer Science, Python (Programming Language), Scalability",1379832,EdX
"IBM: Introduction to Web Development with HTML5, CSS3, and JavaScript",0,4.3,"Front End (Software Engineering), Version Control, Application Development, Gitlab, Cloud Development, Full Stack Development, Web Development, Bootstrap (Front-End Framework), Project Files, Git (Version Control System), HTML5, JavaScript (Programming Language), Back End (Software Engineering), Github, Cascading Style Sheets (CSS)",112704,EdX
AnahuacX: Introducción a la Ciencia de Datos con Python,0,4.3,"Machine Learning, Data Science, Data Mining, Management, Python (Programming Language)",16335,EdX
GTx: User Interface (UI) Personalization,0,4.671710515,"Web Applications, Web Pages, Infrastructure, User Interface",154480,EdX
UPValenciaX: Tecnología accesible para la inclusión,0,4.671710515,"Web Content Accessibility Guidelines, Web Pages, Digital Content, Procurement, Innovation",156986,EdX
IBM: Guided Project: Get Started with MySQL database,0,4.671710515,"Software Engineering, MySQL, Server-Side, Database Management Systems, Full Stack Development, Command-Line Interface",155310,EdX
"UMGC, USMx: Instructional Design: Digital Media, New Tools and Technology",1,4.1,"Integration, Online Teaching, Learning Design, Web Accessibility Testing, Social Media, Content Creation, Web Design, Literacy, Digital Content, Instructional Design, Digital Video, Emerging Technologies, Design And Technology",25075,EdX
"IsraelX, Technion: Model-based Systems Engineering: Advanced Approaches with OPM",2,4.671710515,"Process Flow Diagrams, Systems Engineering, Systems Design, Model Based Systems Engineering",152673,EdX
"IsraelX, Technion: Model-based Systems Engineering: Foundations",0,4.671710515,"Process Flow Diagrams, Systems Engineering, Systems Design, Model Based Systems Engineering",8127,EdX
LinuxFoundationX: Exploring GraphQL: A Query Language for APIs,0,4.671710515,"GraphQL, Application Programming Interface (API), Query Languages, Software Engineering, Front End Design",34593,EdX
IMTx: Digital Networks Essentials,1,4.671710515,"Computer Networks, Computer Science, Unix, Communications, Vocabulary, Transmission Control Protocol (TCP), Virtual Environment",155884,EdX
UPValenciaX: Introduction to SQL and relational databases,0,4.671710515,"Data Extraction, Business Intelligence, Emulators, Relational Databases, SQL (Programming Language), International Standards, Business Software, Relational Database Management Systems",145710,EdX
IMTx: Understanding Artificial Intelligence through Algorithmic Information Theory,2,4.671710515,"Basic Math, Cognitive Science, Turing Machine, Machine Learning, Probability Theories, Computer Science, Aesthetics, Information Theory, Probability, Artificial Intelligence, Innovation, Artificial Neural Networks, Planning",142908,EdX
StanfordOnline: Mining Massive Datasets,2,4.671710515,"Algorithms, MapReduce, PageRank, Link Analysis, Machine Learning, Text Mining, Dimensionality Reduction",146823,EdX
AnahuacX: E-Commerce Estratégico,0,4.671710515,"Customer Experience, Sales Process, Digital Marketing, Marketing, Brand Identity, E-Commerce, Brand Positioning, Communication Strategies, Product Marketing, Target Audience, Sales, Mobile Phones, Search Engine Optimization, Automation, Social Networks, Microsoft Outlook, Branding, Smartphone Operation, Online Store, Social Media, Product Promotion, Customer Service, Brand Strategy, Artificial Intelligence",157173,EdX
TUMx: Make Your Own App,0,4.671710515,"Cascading Style Sheets (CSS), Code Editor, JQuery, HyperText Markup Language (HTML), Motivational Skills, JavaScript (Programming Language), Web Development",30014,EdX
IBM: Django Application Development with SQL and Databases,1,4.671710515,"Full Stack Development, Front End (Software Engineering), SQL (Programming Language), Object-Oriented Programming (OOP), Application Development, Bootstrap (Front-End Framework), Web Application Frameworks, Object-Relational Mapping, Templates, Django (Web Framework)",8425,EdX
W3Cx: HTML5 Apps and Games,2,4.3,"Innovation, HTML5, Application Programming Interface (API)",94695,EdX
AWS: AWS: Getting Started with Cloud Security,0,4,"Amazon Virtual Private Cloud (VPC), Cloud Computing Security, Identity And Access Management, Amazon Elastic Compute Cloud, Amazon Elastic Block Stores, Amazon GuardDuty, AWS CloudTrail, Security Controls, Amazon S3, Solution Architecture, Directory Service, Encryption, News Stories, Amazon Web Services, Demonstration Skills, Amazon CloudWatch",150155,EdX
AWS: Introduction to AWS Identity and Access Management,0,4.671710515,"Amazon Elastic Compute Cloud, Amazon Web Services, AWS Identity And Access Management (IAM), Infrastructure, Troubleshooting (Problem Solving), Identity And Access Management, Amazon S3, Cloud-Native Computing",148295,EdX
FedericaX: Nuove tecnologie digitali,0,4.671710515,"Cascading Style Sheets (CSS), Apache POI, Procedural Programming, Information Theory, Graphical User Interface, Microsoft Windows, Information Processing, Social Networks, HyperText Markup Language (HTML), WordPress, Transmission Systems, Object-Oriented Programming (OOP), Operating Systems, Basic Math, Web Services, Content Management Systems, Presentations, Mathematical Logic, Computer Networks, Telecommunications, Information Technology",154584,EdX
W3Cx: CSS Basics,0,4.4,"Web Development, Web Pages, Presentations, Look And Feel, Web Standards, Character Encodings In HTML, Front End (Software Engineering), Cascading Style Sheets (CSS), Web Design, HyperText Markup Language (HTML)",123752,EdX
W3Cx: JavaScript Introduction,0,3.8,"Cascading Style Sheets (CSS), JavaScript (Programming Language), Front End (Software Engineering), Web Browsers, Web Development, Web Pages, Multimedia",214097,EdX
State-Bank-of-India: Basics of Digital Marketing for All,0,4.671710515,"Personal Branding, Search Engine Optimization, Online Marketing, Marketing, Leverage, Internet Marketing, Email Marketing, Mobile Application Development, Digital Marketing, Social Media, Strategic Planning, Search Engine Marketing",157498,EdX
Google: Advanced Power Searching With Google,2,4.671710515,"Consulting, Marketing Management, Market Research, Internet Research",157565,EdX
StanfordOnline: Interprofessional Education for 21st Century Care,0,4.671710515,"Acute Care, Focus Group",152081,EdX
W3Cx: Introduction to Web Accessibility,0,4.4,"Rich Internet Application, International Standards, Cooperation, Web Content Accessibility Guidelines, Information Technology, Web Accessibility, User Experience, Assistive Technology, Web Accessibility Initiative",63290,EdX
CurtinX: Work with augmented reality (AR) and the web,0,4.671710515,"Apple Xcode, Apple IOS, Augmented Reality",6362,EdX
W3Cx: JavaScript Introduction,0,3.8,"Cascading Style Sheets (CSS), JavaScript (Programming Language), Front End (Software Engineering), Web Browsers, Web Development, Web Pages, Multimedia",214097,EdX
W3Cx: HTML5 and CSS Fundamentals,0,4.6,"Web Standards, Cascading Style Sheets (CSS), HTML5, Front End (Software Engineering), Web Development, Look And Feel, Web Design",403153,EdX
HarvardX: CS50's Mobile App Development with React Native,1,4.671710515,"React.js, Mobile Application Development, ECMAScript 2016, Java (Programming Language), JavaScript (Programming Language), ECMAScript 2015, React Native, Computer Science",150637,EdX
IBM: Full Stack Application Development Project,1,4.671710515,"Front End (Software Engineering), Node.js, Application Development, Full Stack Development, Django (Web Framework), Python (Programming Language), User Interface Design",22439,EdX
IBM: Guided Project: Web Development w/ HTML & CSS for Beginners,0,4.671710515,"Cascading Style Sheets (CSS), Software Engineering, Java (Programming Language), HyperText Markup Language (HTML), Look And Feel",149987,EdX
HarvardX: CS50's Web Programming with Python and JavaScript,1,4.671710515,"Application Deployment, React.js, Application Programming Interface (API), Cloud Computing, Web Development, Cloud Services, Django (Web Framework), SQL (Programming Language), JavaScript (Programming Language), Github, Database Design, Computer Science, Python (Programming Language), Scalability",1379832,EdX
"IBM: Introduction to Web Development with HTML5, CSS3, and JavaScript",0,4.3,"Front End (Software Engineering), Version Control, Application Development, Gitlab, Cloud Development, Full Stack Development, Web Development, Bootstrap (Front-End Framework), Project Files, Git (Version Control System), HTML5, JavaScript (Programming Language), Back End (Software Engineering), Github, Cascading Style Sheets (CSS)",112704,EdX
DelftX: Cyber Security Economics,1,4.671710515,"Technical Analysis, Information Sharing, Data Analysis, Economic Modeling, Investments, Economics, Vulnerability, Security Policies, Cyber Security, Economic Analysis",152667,EdX
RITx: Cybersecurity Fundamentals,2,3.8,"Cyber Security, Infrastructure",204463,EdX
UC3Mx: Cyber Security Basics: A Hands-on Approach,1,4.671710515,"Computer Security, Computer Science, Cyber Security",81352,EdX
RITx: Cybersecurity Risk Management,2,4.4,"Analytical Techniques, Big Data, Risk Management, Quantitative Research, Cost Benefit Analysis, Risk Management Framework, Business Continuity Planning, Business Valuation, Cyber Security, Risk Mitigation, Risk Analytics, Machine Learning, Risk Analysis, Data Mining, Risk Modeling, Management, Cyber Risk",43608,EdX
"AdelaideX: Cyberwar, Surveillance and Security",0,4.671710515,Data Capture (SQL),141309,EdX
IBM: Basic Network and Database Security,0,4.3,"Local Area Networks, SQL Injection, Network Security, MongoDB, Network Routing, Cyber Security, Information Privacy, Computer Networks, Vulnerability, Database Security, Open Systems Interconnection, Research, TCP/IP, Security Systems",10233,EdX
UWashingtonX: Building a Cybersecurity Toolkit,0,5,"Agile Methodology, Cyber Security, Microsoft Outlook",33002,EdX
UWashingtonX: Introduction to Cybersecurity,0,4.6,"Internet Security, Cyber Security, Curiosity",122966,EdX
IBM: Cybersecurity Basics,0,4.1,"Cyber Security, Cyber Threat Intelligence, Critical Thinking",78732,EdX
IBM: Beginners Guide to Cybersecurity,0,4.7,"Encryption, Cyber Security, Technical Support",9873,EdX
HarvardX: CS50's Introduction to Cybersecurity,0,4.671710515,"Cyber Security, Usability",112368,EdX
HarvardX: CS50's AP® Computer Science Principles,0,4.671710515,"Security Software, HyperText Markup Language (HTML), Biology, Finance, Computer Science, Resource Management, Data Structures, JavaScript (Programming Language), C (Programming Language), SQL (Programming Language), PHP (Scripting Language), Algorithms, Forensic Sciences, Cryptography, Cascading Style Sheets (CSS)",160914,EdX
CS50's Introduction to Computer Science,0,4.671710515,"Cascading Style Sheets (CSS), Security Software, Resource Management, Data Structures, HyperText Markup Language (HTML), SQL (Programming Language), JavaScript (Programming Language), Forensic Sciences, Finance, C (Programming Language), Algorithms, Cryptography, Python (Programming Language), Computer Science",5458952,EdX
IBM: Malware Analysis and Assembly Language Introduction,0,4.671710515,"Debugging, Human Readable, Machine Assembly, C (Programming Language), C++ (Programming Language), Assembly Language, Information Gathering, Malware Analysis",160412,EdX
HarvardX: CS50's Web Programming with Python and JavaScript,1,4.671710515,"Application Deployment, React.js, Application Programming Interface (API), Cloud Computing, Web Development, Cloud Services, Django (Web Framework), SQL (Programming Language), JavaScript (Programming Language), Github, Database Design, Computer Science, Python (Programming Language), Scalability",1379832,EdX
"IBM: Introduction to Web Development with HTML5, CSS3, and JavaScript",0,4.3,"Front End (Software Engineering), Version Control, Application Development, Gitlab, Cloud Development, Full Stack Development, Web Development, Bootstrap (Front-End Framework), Project Files, Git (Version Control System), HTML5, JavaScript (Programming Language), Back End (Software Engineering), Github, Cascading Style Sheets (CSS)",112704,EdX
Google: Google AI for JavaScript developers with TensorFlow.js,0,4.6,"Web Applications, Internet Of Things (IoT), Cascading Style Sheets (CSS), Basic Math, Web Engineering, Artificial Intelligence, Deep Learning, Server-Side, Machine Learning, HyperText Markup Language (HTML), JavaScript (Programming Language)",15583,EdX
LinuxFoundationX: Introduction to WebAssembly,0,4.671710515,"Convergent Technologies Operating Systems, Cascading Style Sheets (CSS), Internet Of Things (IoT), JavaScript (Programming Language), Blockchain, HyperText Markup Language (HTML), Serverless Computing, WebAssembly",153435,EdX
HarvardX: Quantitative Methods for Biology,0,4.5,"Data Analysis, MATLAB, Biology, JavaScript (Programming Language), Python (Programming Language), Quantitative Research",59664,EdX
UPValenciaX: IT Fundamentals for Business Professionals: Programming,0,4.671710515,"Telecommunications, Database Management, Cascading Style Sheets (CSS), Information Technology, SQL (Programming Language), HyperText Markup Language (HTML), Web Development, JavaScript (Programming Language), Extensible Markup Language (XML), Object-Oriented Programming (OOP), Information Systems",16689,EdX
HarvardX: CS50's Introduction to Programming with Python,0,4.671710515,"Web Development, Unit Testing, SQL (Programming Language), Data Science, JavaScript (Programming Language), Boolean Expression, Web Browsers, C (Programming Language), Personal Computers, Regular Expressions, Debugging, Python (Programming Language), Computer Science",807505,EdX
DelftX: Introduction to Functional Programming,0,4.671710515,"Scala (Programming Language), Ruby (Programming Language), C++ (Programming Language), Functional Programming, Java (Programming Language), Programming Concepts, JavaScript (Programming Language), .NET Framework, F# (Programming Language), C# (Programming Language), Haskell (Programming Language), PHP (Scripting Language), Python (Programming Language), Clojure, Groovy (Programming Language), Programming Language Design, Visual Basic (Programming Language)",153403,EdX
TUMx: Web App Development with the Power of Node.js,0,4.671710515,"Web Pages, Data Visualization, Application Programming Interface (API), Web Browsers, Software Architecture, Full Stack Development, JavaScript (Programming Language), Model View Controller, Node.js",151709,EdX
W3Cx: JavaScript Introduction,0,3.8,"Cascading Style Sheets (CSS), JavaScript (Programming Language), Front End (Software Engineering), Web Browsers, Web Development, Web Pages, Multimedia",214097,EdX
"UMD, USMx: Creating an Organizational Change Management Framework - Transforming Strategy Execution to Realize Program Value",2,4.671710515,"Governance, Change Management, Benefits Realization Management, Strategy Execution, Organizational Change, Milestones (Project Management), Enterprise Risk Management (ERM), Trenching, Management, Project Management, Mergers And Acquisitions, Business Strategies",159182,EdX
LinuxFoundationX: Securing Your Software Supply Chain with Sigstore,0,4.671710515,"Github, Tooling, Bill Of Materials, Packaging And Labeling, Automation, DevOps, Manifests, Cloud Computing, Security Strategies, Linux, Command-Line Interface, Innovation, Vulnerability, Supply Chain, Open Source Technology, Software Development",154017,EdX
DelftX: Forensic Engineering: Learning from Failures,0,4.671710515,"Forensic Sciences, Architectural Engineering, Aerospace Engineering, Biomechanical Engineering, Investigation, Forensic Engineering, Forecasting",16691,EdX
UBCx: Software Engineering: Introduction,2,4.671710515,"Agile Methodology, Agile Software Development, Software Engineering, Software Systems, Programming Tools, Full Stack Development, Software Development",159019,EdX
IBM: Cybersecurity Basics,0,4.1,"Cyber Security, Cyber Threat Intelligence, Critical Thinking",78732,EdX
HarvardX: CS50's Web Programming with Python and JavaScript,1,4.671710515,"Application Deployment, React.js, Application Programming Interface (API), Cloud Computing, Web Development, Cloud Services, Django (Web Framework), SQL (Programming Language), JavaScript (Programming Language), Github, Database Design, Computer Science, Python (Programming Language), Scalability",1379832,EdX
NYUx: Network Security - Protocols,1,4.671710515,"Address Resolution Protocols, Dynamic Host Configuration Protocol (DHCP), CompTIA Security+, Public Key Cryptography, Algorithms, Access Controls, Wireless Networks, Virtual Private Networks (VPN), Ethical Hacking, Authentications, Network Security, VLAN Hopping, Internet Protocol Security (IP SEC), Transport Layer Security (TLS), Spoofing Attack, Wireless Security, Cryptography, Cyber Security, Penetration Testing, Computer Science, Network Protocols",146061,EdX
ETSx: Understanding the TOEFL Essentials Test,0,4.6,"English Language, Test Of English As A Foreign Language (TOEFL), Research, Writing",21461,EdX
LinuxFoundationX: Secure Software Development: Verification and More Specialized Topics,0,4.671710515,"Threat Modeling, Open Source Technology, Software Engineering, DevOps, Software Development, Cryptography, Linux, Continuous Integration",141789,EdX
IBM: Application Security for Developers,1,4.671710515,"SQL Injection, Network Computing, Systems Development Life Cycle, Development Environment, Static Application Security Testing (SAST), Access Controls, Dynamic Program Analysis, DevSecOps, Vulnerability, Open Web Application Security Project (OWASP), Storage Devices, Software Development Life Cycle, Application Security, Software Development",143269,EdX
UCSanDiegoX: Data Structures Fundamentals,1,4.671710515,"Operations, C++ (Programming Language), Computational Thinking, Algorithms, Java (Programming Language), Python (Programming Language), Data Structures, Priority Queue",52823,EdX
Codio: Java Programming: Intermediate Concepts,0,4.671710515,"Java (Programming Language), Computer Science",155253,EdX
Codio: Java Programming: Object-Oriented Design,0,4.671710515,"Encapsulation (Networking), Object-Oriented Design, Computer Science, Polymorphism, Java (Programming Language)",154381,EdX
Codio: Java Programming: Basic Skills,0,4.671710515,"Computer Science, Java (Programming Language)",147977,EdX
LinuxFoundationX: Building Microservice Platforms with TARS,0,4.671710515,"Software Architecture, Java (Programming Language), Node.js, Python (Programming Language), Microservices, Go (Programming Language), C++ (Programming Language), PHP (Scripting Language), Data Transmissions",148097,EdX
Microsoft: Learn to Program in Java,0,4.671710515,"Java (Programming Language), Software Engineering, Computer Science",158154,EdX
StanfordOnline: Compilers,0,4.671710515,"Parsing, Program Optimization, C++ (Programming Language), Runtime Systems, Object-Oriented Programming (OOP), Compilers, Lexical Analysis, Code Generation, Semantics, Syntax",36057,EdX
IITBombayX: Shell Programming - A necessity for all Programmers,0,4.671710515,"Front End Design, Scripting, Java (Programming Language), Software Development, Python (Programming Language), Automation, C (Programming Language), Unit Testing, LESS, Linux Scripting, Integration Testing, Unix Shell, Shell Commands, C++ (Programming Language)",154281,EdX
GalileoX: Java Programming Fundamentals,1,4.671710515,"Java (Programming Language), Algorithms, Object Oriented Programming And Systems, Object-Oriented Programming (OOP), Conditional Statements",28686,EdX
HarvardX: CS50's Introduction to Programming with Scratch,0,4.671710515,"Visual Programming Language (VPL), Animations, Java (Programming Language), Typing, Python (Programming Language), Computer Science",161771,EdX
PurdueX: AP Computer Science A: Java Programming Loops and Data Structures,0,4.671710515,"Computer Programming, Java (Programming Language), Computer Science, Data Structures",153414,EdX
PurdueX: AP Computer Science A: Java Programming Classes and Objects,0,4.671710515,"Computer Programming, Computer Science, Java (Programming Language), Object-Oriented Programming (OOP), Data Structures",156251,EdX
PurdueX: AP Computer Science A: Java Programming,0,4.671710515,"Java (Programming Language), Object-Oriented Programming (OOP), Computer Programming, Computer Science",153251,EdX
HKUSTx: Introduction to Java Programming – Part 2,0,4.671710515,"Data Abstraction, Java (Programming Language), Object-Oriented Programming (OOP), Integrated Development Environments, Problem Solving",72560,EdX
HKUSTx: Introduction to Java Programming – Part 1,0,4.1,"Data Abstraction, Event-Driven Programming, Java (Programming Language), Object-Oriented Programming (OOP), Integrated Development Environments, Problem Solving",297736,EdX
DelftX: Introduction to Functional Programming,0,4.671710515,"Scala (Programming Language), Ruby (Programming Language), C++ (Programming Language), Functional Programming, Java (Programming Language), Programming Concepts, JavaScript (Programming Language), .NET Framework, F# (Programming Language), C# (Programming Language), Haskell (Programming Language), PHP (Scripting Language), Python (Programming Language), Clojure, Groovy (Programming Language), Programming Language Design, Visual Basic (Programming Language)",155790,EdX
Cooper Union: Preparing for the AP* Computer Science A Exam — Part 1,0,4.671710515,"Creativity, Object-Oriented Programming (OOP), Programming Concepts, Syntax, Software Design Patterns, Algorithms, Google Glass, Problem Solving, Java (Programming Language), Data Structures, Computer Science",149435,EdX
Cooper Union: Preparing for the AP* Computer Science A Exam — Part 2,0,4.671710515,"Creativity, Object-Oriented Programming (OOP), Programming Concepts, Syntax, Software Design Patterns, Algorithms, Google Glass, Problem Solving, Java (Programming Language), Data Structures, Computer Science",158569,EdX
UBCx: Software Construction: Data Abstraction,0,4.671710515,"Junit, Java (Programming Language), Data Abstraction, Software Systems, Object-Oriented Programming (OOP), Software Design Patterns, Software Construction, Polymorphism, Software Development",157036,EdX
GTx: Introduction to Object-Oriented Programming with Java I: Foundations and Syntax Basics,0,4,"Java (Programming Language), Object-Oriented Programming (OOP)",28190,EdX
"WasedaX: Cosmic Rays, Dark Matter, and the Mysteries of the Universe",1,4.671710515,"Solar Systems, Energetic, Space Radiation, Space Stations",14002,EdX
HKUx: Our Place in the Universe,0,4.671710515,"Intellectual Curiosity, Animations",150636,EdX
UAMx: De la granja a la mesa: La seguridad alimentaria en la Unión Europea,0,4.671710515,"Legal Knowledge, English Language, Food Security, Cucumber (Software), Spanish Language",10481,EdX
FedericaX: Psicologia della personalità: un'introduzione,1,4.671710515,"Integration, Artificial Intelligence, Personality Psychology, Psychology",5100,EdX
URosarioX: Leer y escribir en la universidad,0,4.671710515,"Literacy, Academic Writing, Writing",155178,EdX
ANUx: Astrophysics: The Violent Universe,1,4.7,"Textiles, Quantum Mechanics, Astrophysics, Astronomy, Physics",72326,EdX
UPValenciaX: ODS en la Agenda 2030 de las Naciones Unidas: Retos de los Objetivos de Desarrollo Sostenible,0,4.6,"Cooperation, Sustainable Development, Sustainability, Operational Data Store",24935,EdX
