Course_Name,Level,Rating,Skills,Number of students,Platform
Data Engineer,1,4.6,"Data Modeling, Data Pipelines, Data Lakes, Spark, Airflow",98175,Udacity
Data Scientist,2,4.7,"Machine Learning, Deep Learning, Software Engineering",89044,Udacity
Data Analyst,1,4.6,"Data Wrangling, Matplotlib, Bootstrapping, Pandas &amp; NumPy, Statistics",88873,Udacity
C++,1,4.6,"Data Structures &amp; Algorithms, Memory Management, Concurrency, Object-oriented Programming, C++",86627,Udacity
Product Manager,0,4.7,"Product Strategy, Product Design, Product Development, Design Sprint, Product Launch",99575,Udacity
Business Analytics,0,4.7,"Excel &amp; Spreadsheets, SQL, Data Visualization, Data Dashboards",83409,Udacity
Introduction to Programming,0,4.7,"Introduction to Programming, HTML, CSS, Python",96724,Udacity
Digital Marketing,0,4.7,"Digital Marketing, Social Media Marketing, Facebook Marketing, Search Engine Optimization, Search Engine Marketing, Display Ads, Search Ads",86609,Udacity
Deep Learning,1,4.7,"Deep Learning,  Neural Networks,  Jupyter Notebooks,  CNNs,  GANs",90799,Udacity
Blockchain Developer,1,4.5,"Ethereum Blockchain, Blockchain Architecture, Data Auditing",100524,Udacity
UX Designer,0,4.7,"User Research, User Experience, Prototyping, Interactive Design, User Interface Design, Usability Testing",86664,Udacity
Artificial Intelligence for Trading,1,4.6,"Momentum Trading Strategy, Smart Beta, Alpha Factors, Natural Language Processing, Deep Learning, Neural Networks",97393,Udacity
Machine Learning Engineer,1,4.6,"Machine Learning, Supervised Learning, Unsupervised Learning, Deep Learning",86814,Udacity
AI Programming with Python,0,4.6,"Python, NumPy, Pandas, Matplotlib, PyTorch",93792,Udacity
Front End Web Developer,1,4.6,"JavaScript, HTML, CSS, Webpack, Flexbox, Node, Object-oriented Programming",100428,Udacity
Full Stack Web Developer,1,4.5,"Python, JavaScript, PostgreSQL, Flask, Docker, Kubernetes",90290,Udacity
SQL,0,4.6,"SQL, PostgreSQL, JOINs, Subqueries, Window Functions, Partitions, Data Cleaning, DDL, DML, Relational and Non-Relational Databases",91245,Udacity
Machine Learning DevOps Engineer,2,4.581818182,"API development,  Automated model scoring,  CI/CD,  Model testing,  Data Version Control,  Machine Learning Pipelines",85998,Udacity
IntermediatePython,1,4.4,"Python, Object-oriented programming, Modular code, Python Package Index",99668,Udacity
React,1,4.6,"React, Redux, React Native",102201,Udacity
Java Developer,1,4.4,"Java, Spring Boot, Rest API, MySQL, MongoDB",100446,Udacity
AI for Healthcare,2,4.6,"Artificial Intelligence, 2D Medical Imaging, 3D Medical Imaging, Electronic Health Record Data, Deep Learning, Wearable Device Data, Supervised Learning",97054,Udacity
Data Product Manager,1,4.4,"Data Science, Product Management, Product Design, Data Visualization, User Journey Maps",98038,Udacity
Full Stack JavaScript Developer,1,4.581818182,"Creating an API,  Databases and SQL,  Node.js,  Angular,  TypeScript,  Deployment",84049,Udacity
Data Structures and Algorithms,1,4.7,"Data Structures and Algorithms, Problem Solving, Interview Practice Problems, Python",96401,Udacity
Java Programming,0,4.581818182,"Object-oriented programming,  functional programming,  I/O,  reflection,  concurrent programming,  Java modules",87738,Udacity
Android Kotlin Developer,1,4.7,"Android Development, Kotlin, Android Studio, Gradle, RESTful interfaces, Web APIs, App Architecture, Databases, Custom Views, Notifications, Location Services, Testing, Firebase",86050,Udacity
AI Product Manager,0,4.3,"AI Products, Training ML Models, Annotating Datasets, Prototyping a Product",87799,Udacity
Deep Reinforcement Learning,2,4.7,"Reinforcement Learning, Neural Networks, PyTorch, Deep Q-Networks (DQN), Deep Deterministic Policy Gradients (DDPG)",101047,Udacity
Cloud DevOps Engineer,1,4.6,"AWS, Configuration Management with Ansible, Continuous Integration / Continuous Deployment, Microservices with Kubernetes, CloudFormation",98199,Udacity
Computer Vision,2,4.7,"Convolutional Neural Networks, Recurrent Neural Networks, Simultaneous Localization and Mapping, Object Tracking, Image Classification, Deep Learning",89056,Udacity
Robotics Software Engineer,2,4.5,"C++, ROS, Localization, Mapping, SLAM, Navigation, Path Planning, Robot Operating System, Robotics",101314,Udacity
Natural Language Processing,2,4.5,"Machine Learning, Speech Recognition, Sentiment Analysis, Machine Translation, Part of Speech Tagging",97303,Udacity
Data Architect,2,4.4,"Entity relationship diagrams,  Relational Data Design,  Online Analytical Processing,  Operational Data Stores,  Data Lake Architecture,  Data Governance
",91185,Udacity
Cloud Developer,1,4.4,"AWS, Microservices, Serverless Architecture, Kubernetes",91525,Udacity
Intro to Self-Driving Cars,1,4.6,"Computer Vision, Machine Learning, Vehicle Motion, Control",84357,Udacity
Cloud Native Application Architecture,1,4.581818182,"Microservice architecture,  Kubernetes,  Continuous Integration,  Continuous Delivery,  Message Passing,  Observability,  Microservices security",93712,Udacity
Data Streaming,2,4.3,"Data Streaming, Spark, Kafka, Kafka Streaming, Spark Streaming",100281,Udacity
Introduction to Cybersecurity,0,4.5,"Threat Assessment, Security Vulnerabilities, Compliance, Governance, Risk, Incident Response",83934,Udacity
Data Analysis and Visualization with Power BI,0,4.581818182,"Power BI,  data visulations,  data modeling,  Extract-Transform-Load,  Data Analytics Expressions",94267,Udacity
Intro to Machine Learning with PyTorch,1,4.7,"Introduction to Machine Learning, Supervised Learning, Deep Learning, Unsupervised Learning",96455,Udacity
Sensor Fusion Engineer,2,4.7,"Perception, Lidar, Radar, Sensors, Computer Vision",93583,Udacity
Agile Software Development,0,4.6,"Agile, Scrum, Kanban, XP, Minimum Viable Product",97707,Udacity
Intro to Machine Learning with TensorFlow,1,4.7,"TensorFlow, Deep Learning, scikit-learn, Supervised Learning, Unsupervised Learning",95498,Udacity
Ethical Hacker,2,4.581818182,"Vulnerability Management,  Penetration Testing,  Reconnaissance,  Social Engineering,  Open-source intelligence,  System and Application Auditing",101985,Udacity
AWS Cloud Architect,2,4.6,"Cloud Infrastructure, Cloud Security, AWS, CloudFormation, High Availability Infrastructure, Serverless Computing",95573,Udacity
iOS Developer,0,4.6,"Swift programming, Core Data, UIKit, iOS networking, app publishing, User interfaces, Local Persistence, APIs",102950,Udacity
Cloud Developer using Microsoft Azure,1,4.581818182,"Virtual Machines,  App Services,  Microservices,  Serverless Functions,  Cloud Migration",102130,Udacity
IntermediateJavaScript,1,4.4,"Functional Programming, DOM, Data Structures, Asynchronous Programming, Synchronous Programming",93822,Udacity
AI for Business Leaders,1,4.6,"Artificial Intelligence, Machine Learning, Business Strategy, Data Labeling, Data Modeling",86182,Udacity
Predictive Analytics For Business,0,4.7,"Data Wrangling, Classification, A/B Testing, Forecasting, Segmentation",98794,Udacity
Marketing Analytics,0,4.6,"Google Analytics, Excel &amp; Spreadsheets, Data Visualization, Customer Segmentation",87139,Udacity
Machine Learning Engineer for Microsoft Azure,1,4.5,"Azure Machine Learning, Azure Machine Learning SDK, Automation with Pipelines, Automated ML, Machine Learning Operations
",102122,Udacity
Activation and Retention Strategy,1,4.581818182,"Product Management, Activation Funnels, Retention Analysis, Churn Analysis, Segment Analysis, User Engagement, Cohort Analysis",98266,Udacity
Android Basics,0,4.8,"Android Development, Java programming, Android Studio, XML layouts, Android Views",94278,Udacity
Security Engineer,1,4.581818182,"Cryptography, Risk Evaluation, Authentication, Authorization, Access
Management, Penetration Testing",84414,Udacity
Monetization Strategy,1,4.581818182,"Product Management, Monetization Models, Pricing Strategy, Buyer Personas, Lifetime Value, Customer Acquisition Cost, Pricing Metrics, Growth Strategy",85593,Udacity
Artificial Intelligence,2,4.5,"AI Algorithms, Search Algorithms, Optimization, Planning, Pattern Recognition",87962,Udacity
Security Analyst,1,4.581818182,"Security controls,  Defensible Network Architecture,  security threat mitigation,  threat modeling,  vulnerability assessment,  incident detection and handling",92748,Udacity
Data Visualization,0,4.6,"Data Visualization, Tableau, Dashboards, Data Storytelling",86479,Udacity
Flying Car and Autonomous Flight Engineer,2,4.6,"3D Motion Planning, Controls, Estimation, Kalman Filters",101230,Udacity
Data Science for Business Leaders,1,4.4,"Business Strategy, Data Science, Data Architecture, Machine Learning, Human Capital",87253,Udacity
Programming for Data Science with R,0,4.8,"R, SQL, Git",84614,Udacity
Growth Product Manager,1,4.581818182,"Product Management, Growth Strategy, Customer Acquisition, Activation Strategy, Monetization Strategy, Performance Optimization",101257,Udacity
Cloud DevOps using Microsoft Azure,1,4.2,"Infrastructure as Code,  Configuration Management,  Agile Planning,  Continuous Integration,  Continuous Delivery,  Test Automation,  Monitoring",92786,Udacity
RPA Developer with UiPath,0,4.581818182,"Process Automation, Business Operations, UiPath Studio, UiPath Orchestrator",101174,Udacity
Intel® Edge AI for IoT Developers,2,4.7,"Edge AI, Computer Vision, Deep Learning, Edge Computing, AI Modeling, Deep Neural Networks (DNN), Convolutional Neural Networks (CNN), IoT, Intel® Distribution of OpenVINO Toolkit, Intel® DevCloud for the Edge",98730,Udacity
Hybrid Cloud Engineer,1,4.7,"Hyper-converged infrastructure,  Hybrid Cloud,  Public Cloud,  Private Cloud,  HCI Clusters,  Workload Management,  On premise,  Off premise
",88578,Udacity
Cloud Computing for Business Leaders,1,4.581818182,"Digital transformation,  leadership,  management,  cloud governance model,  novel cloud services,  operational efficiencies,  cloud center of excellence",99186,Udacity
Self Driving Car Engineer,2,4.581818182,"Computer Vision, Deep Learning, Sensor Fusion, Localization, Self-Driving Cars, Path Planning and Control",101974,Udacity
Differential Equations in Action,1,4.581818182,"Math, Differential Equations",88529,Udacity
Self-Driving Fundamentals: Featuring Apollo ,0,4.581818182,"Apollo HD Map, Localization, Perception, Prediction, Planning, Control",86380,Udacity
Introduction to Machine Learning using Microsoft Azure,1,4.581818182,"Machine Learning,  Azure,  Model Training,  Supervised &amp; Unsupervised Learning,  Responsible AI",98395,Udacity
AI Fundamentals,0,4.581818182,"Artificial Intelligence,  Machine Learning,  Azure,  Computer Vision,  Azure Cognitive Services,  Natural Language Processing,  Conversational AI",84107,Udacity
Linear Algebra Refresher Course,1,4.581818182,"Algebra, Python, Vectors, Intersections",93232,Udacity
Machine Learning: Unsupervised Learning,1,4.581818182,"Randomized Optimization, Clustering, Feature Selection, Feature Transformation, Information Theory",95151,Udacity
Big Data Analytics in Healthcare,1,4.581818182,"Data Analytics, Health Care Applications, Algorithms",101503,Udacity
Intro to Descriptive Statistics,0,4.581818182,"Descriptive Statistics, Estimation, Central Limit Theorem",92239,Udacity
Intel® Edge AI Fundamentals with OpenVINO,1,4.581818182,"Edge AI, Intel OpenVINO, Computer Vision, Deep Learning",94748,Udacity
Artificial Intelligence,1,4.581818182,"Artificial Intelligence, Probability, Bayesian Networks, Logic and Planning, Machine Learning",95353,Udacity
Model Building and Validation,2,4.581818182,"Questioning, Modeling, Validation, Data Analysis, QMV Process",98493,Udacity
Data Visualization and D3.js,1,4.581818182,"d3.js, Design of Visualizations, Data Visualization, Visual Encodings",93627,Udacity
Machine Learning for Trading,1,4.581818182,"Pandas, Time Series Analysis, Computational Investing, Algorithmic Trading, Reinforcement Learning for Trading",89937,Udacity
Machine Learning,1,4.581818182,"Supervised Learning, Unsupervised Learning, Information Theory, Reinforcement Learning, Game Theory",96085,Udacity
Intro to Hadoop and MapReduce,1,4.581818182,"Big Data, Hadoop, MapReduce",88799,Udacity
Real-Time Analytics with Apache Storm,1,4.581818182,"Data Analysis, Real-time Analytics, Apache Storm",86327,Udacity
A/B Testing,1,4.581818182,"A/B tests,  Results Analysis,  Statistical Significance ",102600,Udacity
Data Analysis with R,1,4.581818182,"R, Exploratory Data Analysis, Data Visualization",90896,Udacity
Knowledge-Based AI: Cognitive Systems,2,4.581818182,"Semantic Networks, Common-Sense Reasoning, Logic &amp; Planning, Analogical Reasoning, Visuospatial Reasoning",101131,Udacity
Introduction to TensorFlow Lite,1,4.581818182,"TensorFlow Lite, Deep Learning Models, Android, iOS, Linux",102137,Udacity
Introduction to Computer Vision,1,4.581818182,"Image Processing, Stereo Geometry, Feature Detection &amp; Matching, Object Tracking, Classification &amp; Recognition",102621,Udacity
Eigenvectors and Eigenvalues,0,4.581818182,"Linear Algebra, Eigenvectors, Eigenvalues",87199,Udacity
Intro to Artificial Intelligence,1,4.581818182,"Artificial Intelligence, Machine Learning, Probability, Logic and Planning, Markov models",99576,Udacity
Artificial Intelligence for Robotics,2,4.581818182,"Probabilistic Models, Kalman Filters, Motion Planning, Robot Control, Simultaneous Localization &amp; Mapping",103317,Udacity
Intro to Deep Learning with PyTorch,1,4.581818182,"Deep Learning, PyTorch, Neural Networks, CNNs, LSTMs, Style Transfer",86088,Udacity
AWS DeepRacer,1,4.581818182,"Machine Learning, Reinforcement Learning, AWS DeepRacer",84970,Udacity
Introduction to Machine Learning Course,1,4.581818182,"Machine Learning, Supervised Learning, Unsupervised Learning, Evaluation Metrics, Data Manipulation",100591,Udacity
Rapid Prototyping,1,4.581818182,"Prototyping, User Research, inVision",95154,Udacity
Product Design,1,4.581818182,"Product Design, Design Sprints, Ideation and Validation, UI/UX",94762,Udacity
App Monetization,1,4.581818182,"Product Design, Google Analytics",93016,Udacity
A/B Testing for Business Analysts,1,4.581818182,"A/B Randomized Design Tests, A/B Matched Pair Design Tests",86357,Udacity
Product Manager Interview Preparation,0,4.581818182,"Product Management, Interview Preparation, Career Advancement, Product Strategy, Technical Interview",90546,Udacity
Hybrid Cloud Fundamentals,1,4.581818182,"Hybrid Cloud, Nutanix, Hyperconverged Infrastructure, Prism web console, Private Cloud, Virtual Machine",103025,Udacity
Intro to Cloud Computing,0,4.581818182,"Cloud Computing,  AWS Console,  Compute Services,  Serverless Architecture,  Cloud Databases",89118,Udacity
Intro to Information Security,1,4.581818182,"Software Security, Cryptography, Network Security, Privacy, Public Policy",83531,Udacity
Cyber-Physical Systems Security,1,4.581818182,"Industrial Networks, Industrial Control Systems, Smart Grid Infrastructure, Cyber Security, Privacy",102364,Udacity
Network Security,1,4.581818182,"Basic elements of cryptography,  cryptanalysis and systems security,  security research",99235,Udacity
Creating an Analytical Dataset,0,4.581818182,"Data Issues, Data Formatting, Data Blending",86904,Udacity
Problem Solving with advancedAnalytics,0,4.581818182,Linear Regression,100461,Udacity
Classification Models,1,4.581818182,"Binary Classication Models, Non-Binary Classification Models",90779,Udacity
Segmentation and Clustering,1,4.581818182,"Variable Reduction, Clustering Models design",85344,Udacity
Time Series Forecasting,1,4.581818182,"Time Series Forecasting, ETS Models, ARIMA Models",87652,Udacity
App Marketing,1,4.581818182,"App Marketing, User Segmentation, Customer Acquisition",98306,Udacity
How to Build a Startup,1,4.581818182,"Entrepreneurship, Value Proposition, Revenue Models, Customer Segments",100686,Udacity
Get Your Startup Started,1,4.581818182,"Entrepreneurship, Bootstrapping",100659,Udacity
Managing Remote Teams with Upwork,0,4.581818182,"Team Management, Workforce Training, Business Strategy, Agile Management, Remote Work",98204,Udacity
Intro to Data Science,1,4.581818182,"Data Analysis Process, pandas (Python package), MapReduce paradigm",85006,Udacity
Intro to Data Analysis,0,4.581818182,"Data Analysis, Python, numpy, pandas",102430,Udacity
Database Systems Concepts & Design,1,4.581818182,"Database Management Systems, Relational Algebra, Sequential Query Language, Data Indexing, SQL Injection",85771,Udacity
Intro to Inferential Statistics,0,4.581818182,"Inferential Statistics, Hypothesis Testing, T-tests, ANOVA",102230,Udacity
Spark,1,4.581818182,"Spark, SparkSQL, Spark Dataframes, Data Wrangling, Machine Learning",87202,Udacity
Data Analysis and Visualization,1,4.581818182,"R, Data Analysis, Data Visualization, Regression",91411,Udacity
Microsoft Power Platform,0,4.581818182,"Microsoft Power Platform, Power Apps, Power Automate, Azure AI Builder",98612,Udacity
Web Tooling & Automation,1,4.581818182,"Installing Sublime Text, Installing Plugins, Gulp, Live Editing, ESLint",98906,Udacity
Front End Frameworks,2,4.581818182,"Single Page Applications, Building Angular apps, Building Ember apps, Underscore's template function, Backbone events and routing",100255,Udacity
Responsive Web Design Fundamentals,1,4.581818182,"Responsive design patterns, Remote debugging and emulation, Optimizing layout, CSS media queries, CSS flexbox",102858,Udacity
Linux Command Line Basics,0,4.581818182,"Command line interface (Linux server), Terminal and Shell (GNU Bash), Linux filesystem, Shell commands",86199,Udacity
How to Install Android Studio,0,4.581818182,"Android, Android Studio, Java",83382,Udacity
Android Basics: Multiscreen Apps,0,4.581818182,"Android Development, Intents and Activities, Data, Loops and Custom Classes, Images and Visual Polish, Audio and Libraries",88307,Udacity
Website Performance Optimization,1,4.581818182,"Chrome Developer Tools, DOM and CSSOM, Critical Rendering Path HTML, CSS and JavaScript optimizations",91816,Udacity
iOS Networking with Swift,2,4.581818182,"Networking, URLSession, JSON Parsing",88179,Udacity
JavaScript Design Patterns,2,4.581818182,"Separating concerns, Code organization, Using an Organizational Library, KnockoutJS",89570,Udacity
Android Basics: User Input,0,4.581818182,"Android Development, Java, Object-Oriented Programming, Conditional Code, Methods, Variables",92451,Udacity
Android Performance,2,4.581818182,"Android Development, Performance, Optimization",84732,Udacity
Responsive Images,1,4.581818182,"Responsive Images, Mobile Image debugging, Creating responsive graphics",102515,Udacity
Xcode Debugging,2,4.581818182,"Debugging, LLDB",92304,Udacity
Gradle for Android and Java,2,4.581818182,"Android Development, Gradle, Java",88129,Udacity
Build Native Mobile Apps with Flutter,1,4.581818182,Android Development,89183,Udacity
JavaScript Promises,2,4.581818182,"Native JavaScript Promises, Asynchronous code, advancederror handling, Generating sequences of async work",91880,Udacity
UIKit Fundamentals,1,4.581818182,"AutoLayout, Navigation, Table Views, Collection Views",99711,Udacity
Android Basics: User Interface,0,4.581818182,"Android Development, Building Layouts, Android Studio, Views and ViewGroups, Styling",102536,Udacity
Client-Server Communication,2,4.581818182,"HTTP request and response cycle, HTTP headers and verbs, HTTP/1 and HTTP/2 capabilities, HTTPS, Client-Server Communication",92124,Udacity
Building High Conversion Web Forms,1,4.581818182,"Research HTML5 input types, Datalist input, User input validation with HTML5 attributes, Validate user input using JavaScript, Optimizing forms",97291,Udacity
advancedAndroid App Development,2,4.581818182,"Android Development, Fragments, Libraries, Firebase, Espresso",93106,Udacity
Software Architecture & Design,1,4.581818182,"Unified Modeling Language, Object Constraint Language, Software Architecture, Software Design, Code Review",94974,Udacity
Authentication & Authorization: OAuth,1,4.581818182,"Flask, OAuth 2.0, Authentication &amp; Authorization, Python",91748,Udacity
Intro to iOS App Development with Swift,1,4.581818182,"Swift, UIKit, AVFoundation",96667,Udacity
Introduction to Operating Systems,1,4.581818182,"Processes &amp; Threads, Memory Management, Inter-Process Communication, Resource Virtualization, Distributed File Systems",90844,Udacity
Android Basics: Networking,0,4.581818182,"Android Development, JSON Parsing, HTTP Networking, Threads and Parallelism, Control Flow and Conditionals, Preferences",89545,Udacity
Web Accessibility,2,4.581818182,"Accessibility, Screen Readers, Focus, Semantics, ARIA",91807,Udacity
Android Basics: Data Storage,0,4.581818182,"Android Development, SQLite, ContentProvider, CursorAdapter &amp; CursorLoader, Database, Design",85978,Udacity
Scalable Microservices with Kubernetes,1,4.581818182,"Microservices, Docker, Kubernetes, Deploying Microservices",86644,Udacity
Developing Android Apps with Kotlin,1,4.581818182,Android Development,97282,Udacity
Browser Rendering Optimization,2,4.581818182,"Browser Rendering Response, Animation, Idle and Load (RAIL), Optimizing JavaScript, How to debug an app",87534,Udacity
Learn Swift Programming Syntax,1,4.581818182,"Variables and Constants, Control Flow, Functions, Optionals, OOP",89041,Udacity
Offline Web Applications,1,4.581818182,"Developing offline-first applications, Understanding Lie-Fi, Service Worker DevTools, IndexedDB, IndexedDB asset caching",95039,Udacity
Kotlin for Android Developers,2,4.581818182,"Kotlin, Android",95403,Udacity
UX Design for Mobile Developers,0,4.581818182,"Android, UX Design, User-Centered Design",99205,Udacity
Software Development Process,1,4.581818182,"Software Development Life Cycle, Requirements Engineering, Design Patterns, Black-Box &amp; White-Box Testing, Agile Development Methodology",96473,Udacity
Data Visualization in Tableau,0,4.581818182,"Tableau, Design of Visualizations, Visual Encodings",83963,Udacity
Intro to Progressive Web Apps,1,4.581818182,"Progressive Web Apps, Service Workers, Web App Manifest, Offline apps",89569,Udacity
Writing READMEs,0,4.581818182,"README, Markdown, Making code easier to read",97988,Udacity
Software Analysis & Testing,1,4.581818182,"Software Testing, Debugging, Dataflow Analysis, Constraint-based Analysis, Symbolic Execution",95791,Udacity
iOS Persistence and Core Data,2,4.581818182,"Data Persistence, Core Data, UserDefaults, FileManager",98973,Udacity
Computer Networking,1,4.581818182,"Software-Defined Networking, Data Center Networking, Content Distribution, Congestion Control, Traffic Shaping",86324,Udacity
Firebase Analytics: iOS,1,4.581818182,"Android Development, Firebase Analytics, Firebase Crash Reporting, Firebase Remote Config, Firebase Dynamic Links",94784,Udacity
Human-Computer Interaction,1,4.581818182,"Design Principles, Direct Manipulation Interfaces, Mental Models, Distributed Cognition, Prototyping",88021,Udacity
2D Game Development with libGDX,1,4.581818182,"LibGDX, Game Development, 2D",89418,Udacity
Intro to jQuery,1,4.581818182,"jQuery, DOM Structure, Reading jQuery documentation, Modify HTML attributes and content",102004,Udacity
How to create <anything> in Android,0,4.581818182,"Android, UI, App Development",92288,Udacity
Dynamic Web Applications with Sinatra,1,4.581818182,"Ruby, Sinatra, Building web applications",91420,Udacity
How to Make a Platformer Using libGDX,1,4.581818182,"LibGDX, Game Development, Asset management",88754,Udacity
JavaScript Testing,1,4.581818182,"Javascript Apps, Jasmine testing framework, red-green-refactor workflow",87243,Udacity
Object-Oriented JavaScript,1,4.581818182,"Object Oriented Javascript, Object-oriented programming, Data and functionality, Prototypal inheritance",92191,Udacity
Localization Essentials,0,4.581818182,"Localization, Google Translator Toolkit, Localization at Google",92689,Udacity
Compilers: Theory and Practice,1,4.581818182,"Compilers, Semantic Analysis, Syntax Directed Translation, Control Flow Analysis",85339,Udacity
HTML5 Canvas,0,4.581818182,"HTML5 Canvas, Canvas2D, Creating animation",90698,Udacity
Object Oriented Programming in Java,1,4.581818182,"Object-Oriented Programming, Java, User Interaction",92841,Udacity
Designing RESTful APIs,1,4.581818182,"Flask, REST APIs, Python",85669,Udacity
GT - Refresher - advancedOS,1,4.581818182,"Operating Systems, Virtual Memory, File Systems, Multithreaded Programming, Networking",96341,Udacity
Intro to JavaScript,0,4.581818182,"JavaScript, Conditionals, Loops, Data Types &amp; Variables",95836,Udacity
Grand Central Dispatch (GCD),1,4.581818182,"Closures, GCD",97093,Udacity
Continuous Integration and Deployment,1,4.581818182,"Continuous Integration, BuddyBuild, Automated Testing",90118,Udacity
Swift for Beginners,0,4.581818182,"Variables and Constants, Strings, Control Flow, Functions",95811,Udacity
Intro to Statistics,0,4.581818182,"Probability, Descriptive Statistics, Inferential Statistics",89343,Udacity
Intro to HTML and CSS,0,4.581818182,"HTML, CSS, CSS Syntax, HTML Syntax Problem Set",93447,Udacity
Developing Android Apps,1,4.581818182,"Android Development, Layouts, Intents, UI",100529,Udacity
Introduction to Virtual Reality,0,4.581818182,"VR development, Unity, Google VR SDK for Unity, General understanding of how VR works, Deploying to Android and iOS",92728,Udacity
Objective-C for Swift Developers,1,4.581818182,"iOS, Swift, Objective-C, Control Flow Syntax",97032,Udacity
Software Testing,1,4.581818182,"Software Testing, Debugging, Code Coverage",86905,Udacity
Interactive 3D Graphics,1,4.581818182,"Animated 3D Demo Program, Computer Image Generation, Programming Vertex and Pixel Shaders",97225,Udacity
Full Stack Foundations,1,4.581818182,"Flask, CRUD, Model-View-Controller, Python, Object-relational Mapping",93738,Udacity
